{
  "schemaVersion": "2.0",
  "type": "collection-index",
  "id": "collection.hadith-character",
  "itemType": "lesson",
  "title": {
    "id": "Hadis, Sunnah, dan akhlak",
    "en": "Hadith, Sunnah, and character"
  },
  "items": [
    {
      "id": "lesson.intention-guidance",
      "type": "lesson",
      "slug": "intention-guidance",
      "path": "content/lessons/stage-6/intention-guidance.json",
      "stageId": "stage.hadith-character",
      "stageOrder": 1,
      "group": "thematic-guidance"
    },
    {
      "id": "lesson.honesty-guidance",
      "type": "lesson",
      "slug": "honesty-guidance",
      "path": "content/lessons/stage-6/honesty-guidance.json",
      "stageId": "stage.hadith-character",
      "stageOrder": 2,
      "group": "thematic-guidance"
    },
    {
      "id": "lesson.guarding-speech-guidance",
      "type": "lesson",
      "slug": "guarding-speech-guidance",
      "path": "content/lessons/stage-6/guarding-speech-guidance.json",
      "stageId": "stage.hadith-character",
      "stageOrder": 3,
      "group": "thematic-guidance"
    },
    {
      "id": "lesson.parents-guidance",
      "type": "lesson",
      "slug": "parents-guidance",
      "path": "content/lessons/stage-6/parents-guidance.json",
      "stageId": "stage.hadith-character",
      "stageOrder": 4,
      "group": "thematic-guidance"
    },
    {
      "id": "lesson.compassion-guidance",
      "type": "lesson",
      "slug": "compassion-guidance",
      "path": "content/lessons/stage-6/compassion-guidance.json",
      "stageId": "stage.hadith-character",
      "stageOrder": 5,
      "group": "thematic-guidance"
    },
    {
      "id": "lesson.eating-guidance",
      "type": "lesson",
      "slug": "eating-guidance",
      "path": "content/lessons/stage-6/eating-guidance.json",
      "stageId": "stage.hadith-character",
      "stageOrder": 6,
      "group": "thematic-guidance"
    },
    {
      "id": "lesson.sleeping-guidance",
      "type": "lesson",
      "slug": "sleeping-guidance",
      "path": "content/lessons/stage-6/sleeping-guidance.json",
      "stageId": "stage.hadith-character",
      "stageOrder": 7,
      "group": "thematic-guidance"
    },
    {
      "id": "lesson.neighbors-guidance",
      "type": "lesson",
      "slug": "neighbors-guidance",
      "path": "content/lessons/stage-6/neighbors-guidance.json",
      "stageId": "stage.hadith-character",
      "stageOrder": 8,
      "group": "thematic-guidance"
    },
    {
      "id": "lesson.seeking-knowledge-guidance",
      "type": "lesson",
      "slug": "seeking-knowledge-guidance",
      "path": "content/lessons/stage-6/seeking-knowledge-guidance.json",
      "stageId": "stage.hadith-character",
      "stageOrder": 9,
      "group": "thematic-guidance"
    }
  ]
}
